[
  {
    "id": "ev-001",
    "statement": "Thornhaven is a small village of approximately 12 stone buildings around a central well.",
    "classification": "explicit_evidence",
    "confidence": 1.0,
    "source_turns": ["turn-002"],
    "related_entities": ["loc-thornhaven"],
    "related_threads": [],
    "notes": "Directly stated by the DM."
  },
  {
    "id": "ev-002",
    "statement": "All shutters in Thornhaven are closed and streets are empty at dusk.",
    "classification": "explicit_evidence",
    "confidence": 1.0,
    "source_turns": ["turn-002"],
    "related_entities": ["loc-thornhaven"],
    "related_threads": [],
    "notes": "Directly stated by the DM."
  },
  {
    "id": "ev-003",
    "statement": "The Broken Wheel inn is the only building showing light.",
    "classification": "explicit_evidence",
    "confidence": 1.0,
    "source_turns": ["turn-002"],
    "related_entities": ["loc-broken-wheel-inn"],
    "related_threads": [],
    "notes": "Directly stated by the DM."
  },
  {
    "id": "ev-004",
    "statement": "A crow perched on the inn sign watched the player with 'unsettling intelligence' — this detail may be narrative flavor, a familiar, or a deliberate DM hook.",
    "classification": "dm_bait",
    "confidence": 0.4,
    "source_turns": ["turn-002"],
    "related_entities": ["creature-crow"],
    "related_threads": [],
    "notes": "The phrase 'unsettling intelligence' is ambiguous. Could be atmospheric description or a genuine narrative hook. Do not act on this as fact."
  },
  {
    "id": "ev-005",
    "statement": "The deserted village streets may indicate that villagers are hiding from a threat.",
    "classification": "inference",
    "confidence": 0.6,
    "source_turns": ["turn-002"],
    "related_entities": ["loc-thornhaven"],
    "related_threads": [],
    "notes": "Inferred from empty streets and closed shutters. Alternative: the village could simply have a small, reclusive population or a curfew custom."
  }
]
